{
  "version": "0.1.0",
  "constants": {
    "dunRooms": 50,
    "blockHeight": 10,
    "blockWidth": 10,
    "baseMonsterCount": 14
  },
  "stairs": {
    "upMin": 1,
    "upMax": 2,
    "downMin": 3,
    "downMax": 4
  },
  "roomTypeWeightsByDepth": [
    { "minDepth": 1, "maxDepth": 20, "weights": { "type1": 40, "type2": 25, "type3": 15, "type4": 10, "type5": 5, "type6": 5 } }
  ],
  "trapDistributionByDepth": [
    { "minDepth": 1, "maxDepth": 15, "trapIds": ["trap_dart_slow", "trap_pit", "trap_blind_gas"] }
  ]
}